Topic,Count,Resolution,Examples
poor_cellular_network_coverage_at_specific_location,41, ,"[""Improvement needed: Just coverage in some place I go isn't the best but I understand that this will be fixed next year\nReason for given NPS: Always been wth Vodafone,best service and best prices."", 'Improvement needed: Your connectivity\nReason for given NPS: There are a few things need sorting with our internet and phone connection. Bad weather can affect coverage and often connections will drop out unexpectantly', 'Improvement needed: Still a few holes in service in metro areas. Luckily you have wifi calling backup!!\nReason for given NPS: Seems reasonable. Easy roaming. Looking forward to starlink hookup', ""Improvement needed: I think costs have risen service is no better the app and website arnt usable. Reception is poor in our house and the modem drops out. I'd be happier if 10$ less a month frankly\nReason for given NPS: Reception cover poor vs spark"", 'Improvement needed: connection through the modem, from one room to the next in my house it drops out. and when following up with concerns the comms over the phone many atimes there has been a slight language barrier which does not help the comms to move forward after lengthy waiting.\nReason for given NPS: connection is terrible']"
need_for_affordable_pricing_plans,27, ,"['Improvement needed: Make a better/cheaper plan\nReason for given NPS: Your quite Expensive', 'Improvement needed: Better priced plans\nReason for given NPS: Seem a little more expensive than competitors', 'Improvement needed: Offer lower cost plans/packages.\n', 'Improvement needed: Cheaper rates\n', 'Improvement needed: Cheaper plans. Look after loyal longtime customers\nReason for given NPS: Nothing to note on changes since became one Nz. Everything is fine.']"
poor_cellular_network_coverage_in_rural_areas,22, ,"[""Improvement needed: I live semi-rural and cellphone coverage is really patchy. When we have power cuts that's it. Can't use internet on phone so go old school with battery radio to find out what's going on. Not really a One problem but it's an issue that really affects people in the country.\nReason for given NPS: I have had no issues with One and having been with them (and their iterations) from year dot I am very brand loyal."", 'Improvement needed: Service in rural areas\n', 'Improvement needed: Mobile network in the country rural areas\nReason for given NPS: Great service', 'Improvement needed: Keep improving NZ wide cellular coverage.\nReason for given NPS: The service team in Hastings made my transition from old company easy.', 'Improvement needed: Mobile coverage\nReason for given NPS: Great service']"
difficulties_reaching_customer_care_staff,20, ,"['Improvement needed: Sometimes hard to understand an operator when talking to them found it easier going into a store\n', 'Improvement needed: Broadband speed, it continually slows down.\nFaster access to help via phone.\n', 'Improvement needed: valued assistance, value long servicing customers\nReason for given NPS: difficulty when phoning for assistance and the wait time', 'Improvement needed: connection through the modem, from one room to the next in my house it drops out. and when following up with concerns the comms over the phone many atimes there has been a slight language barrier which does not help the comms to move forward after lengthy waiting.\nReason for given NPS: connection is terrible', 'Improvement needed: Customer service- also cisibility or recommending best current plans and pricing\nReason for given NPS: Much of a much mess providers- your customer service in store is terrible and also on phone -takes ages to get through.']"
customer_wants_cheaper_pricing_plans,19, ,"['Improvement needed: Make a better/cheaper plan\nReason for given NPS: Your quite Expensive', 'Reason for given NPS: I find it good but some people want different options', 'Improvement needed: Cheaper rates\n', 'Improvement needed: I am totally happy with the service that you currently provide Obviously with the way that the world is at the moment Cheaper plans would always be a huge benefit as everyone including myself are struggling financially at the moment\nReason for given NPS: Great service and its a new zealand call centre so you provide jobs for New Zealanders Loved the seamless transition from Vodafone to One . Highly recommend to all :)', 'Improvement needed: Expensive at plan\nReason for given NPS: Good experience']"
lack_of_value_for_money,18, ,"[""Improvement needed: I think costs have risen service is no better the app and website arnt usable. Reception is poor in our house and the modem drops out. I'd be happier if 10$ less a month frankly\nReason for given NPS: Reception cover poor vs spark"", 'Improvement needed: Expensive at plan\nReason for given NPS: Good experience', 'Improvement needed: Broadband should be faster as the the Vodafone to worth with the money I pay\nReason for given NPS: Before when it was with Vodafone it was worth paying the bills it was faster as the agreement as soon as the time that ONE NZ start maaan it was really bad slow 🤦🏽\u200d♀️… when I call and report how many times and nothing change it still the same so I’m thinking of change to another company', 'Improvement needed: More competitive pricing\n', 'Improvement needed: No affordable plans, ridiculous prices. Customer service below average. What we pay for is not worth it\n']"
slow_call_center_response_times,16, ,"['Improvement needed: Broadband speed, it continually slows down.\nFaster access to help via phone.\n', 'Improvement needed: connection through the modem, from one room to the next in my house it drops out. and when following up with concerns the comms over the phone many atimes there has been a slight language barrier which does not help the comms to move forward after lengthy waiting.\nReason for given NPS: connection is terrible', 'Improvement needed: It is quite difficult to deal with the call centre at times .. much easier to just go into the store to sort out problems when possible .. call centre could definitely do with some improvement\n', 'Improvement needed: Customer support\nReason for given NPS: Happy with my service', 'Improvement needed: The entire customer service regime and experience\nReason for given NPS: Customer service is poor. The call center is not responsive. I waited for 6+ months for a response to transfer my customer details for Sky TV from Vodafone TV to Sky TV. It has never happened. I have up and now subscribe to Sky Now and have missed the opportunity to be transferred properly to the products I have asked for. I have also had my broadband plan intermittently cancelled when I have upgraded my plan. I have never had a good customer experience.']"
long_wait_times_on_customer_calls,15, ,"['Improvement needed: valued assistance, value long servicing customers\nReason for given NPS: difficulty when phoning for assistance and the wait time', 'Improvement needed: connection through the modem, from one room to the next in my house it drops out. and when following up with concerns the comms over the phone many atimes there has been a slight language barrier which does not help the comms to move forward after lengthy waiting.\nReason for given NPS: connection is terrible', 'Improvement needed: Customer service- also cisibility or recommending best current plans and pricing\nReason for given NPS: Much of a much mess providers- your customer service in store is terrible and also on phone -takes ages to get through.', 'Improvement needed: Less wait times\n', 'Improvement needed: Fast handling when called in for assistance as wait time could be a bit long which has been improved but still too long\nReason for given NPS: Long term customer and i had no issue with services provided so far and time to time, received call from one nz for any promotion that was on at the time which i have accepted few times which i appreciated']"
lack_of_recognition_for_long_term_customers,13, ,"['Improvement needed: valued assistance, value long servicing customers\nReason for given NPS: difficulty when phoning for assistance and the wait time', 'Improvement needed: Rewards - offer to customers, not chances by entering competitions\nLong time royal customers - offer discounts every now and then or some other rewards given to them\nReason for given NPS: One NZ is not offering any better benefits than some other companies', 'Improvement needed: Return of new phone + contact deals for existing (especially long-term) customers! Also, Google Pixel phones.\n', 'Improvement needed: Given that one of the questions were about ""feeling valued"" - more could probably be done to enhance that. I have been using Vodafone / One for many years now and don\'t see any reason to change, however, things like loyalty discounts are always acknowledged and respected from service providers.\nReason for given NPS: Very easy to manage services and at a reasonable market price.', 'Improvement needed: Rewards in the form of lower plan costs for combined family plans as well as locality for years/ decades as a customer.\nReason for given NPS: Always been reliable.']"
lack_of_value_for_existing_customers,13, ,"['Improvement needed: Perhaps some of the deals that are offered to new customers could be given to us that have stuck with you for a number of years\nReason for given NPS: All contact with your services been excellent', 'Improvement needed: Cheaper plans. Look after loyal longtime customers\nReason for given NPS: Nothing to note on changes since became one Nz. Everything is fine.', 'Improvement needed: Rewards - offer to customers, not chances by entering competitions\nLong time royal customers - offer discounts every now and then or some other rewards given to them\nReason for given NPS: One NZ is not offering any better benefits than some other companies', ""Improvement needed: Pricing deals for existing customers.\nReason for given NPS: The service provided is great but I feel I'm currently paying a lot for our broadband as our discount ended."", 'Improvement needed: Return of new phone + contact deals for existing (especially long-term) customers! Also, Google Pixel phones.\n']"
poor_customer_service_experience,12, ,"['Improvement needed: valued assistance, value long servicing customers\nReason for given NPS: difficulty when phoning for assistance and the wait time', 'Improvement needed: Customer service- also cisibility or recommending best current plans and pricing\nReason for given NPS: Much of a much mess providers- your customer service in store is terrible and also on phone -takes ages to get through.', 'Improvement needed: Customer service. Number 2 would be allowing more contract flexibility (ie. allowing us to fix for 24 and 36 months).\nReason for given NPS: Good service, our internet seems to be working well, but we are missing the price advantages of your former partnering with Sky for bundling purposes', 'Improvement needed: Customer service & technical knowledge in the Cambridge One Nz store( very keen to hook me in tgen disinterested. A staff member actually used my new I phone to claim my Spotify hours so very unimpressed.\nReason for given NPS: I like the response One Nz is making to block pornography of children from reaching or being able to access by anyone in Nz; also agree with the commitment to ensure total accessibility of mobile phone users through out Nz', 'Improvement needed: No affordable plans, ridiculous prices. Customer service below average. What we pay for is not worth it\n']"
prolonged_hold_times_for_assistance,12, ,"['Improvement needed: connection through the modem, from one room to the next in my house it drops out. and when following up with concerns the comms over the phone many atimes there has been a slight language barrier which does not help the comms to move forward after lengthy waiting.\nReason for given NPS: connection is terrible', 'Improvement needed: Customer service- also cisibility or recommending best current plans and pricing\nReason for given NPS: Much of a much mess providers- your customer service in store is terrible and also on phone -takes ages to get through.', 'Improvement needed: Customer support\nReason for given NPS: Happy with my service', 'Improvement needed: Less wait times\n', ""Improvement needed: Cost is always a consideration, particularly when one is on a limited income ie: pension.\nWould it be possible to instigate a discount for Gold card members? This wouldn't impact on your profit very much.\nThe other thing that is annoying to a large group of customers is the time it takes to get assistance over the phone. Sometimes it is easier to travel to a ONE shop for assistance.\nReason for given NPS: I put 5 down because I am unsure about other companies out there and how you compare to them.""]"
slow_laggy_internet_speed,12, ,"['Improvement needed: Broadband speed, it continually slows down.\nFaster access to help via phone.\n', 'Improvement needed: Broadband should be faster as the the Vodafone to worth with the money I pay\nReason for given NPS: Before when it was with Vodafone it was worth paying the bills it was faster as the agreement as soon as the time that ONE NZ start maaan it was really bad slow 🤦🏽\u200d♀️… when I call and report how many times and nothing change it still the same so I’m thinking of change to another company', 'Improvement needed: Giving us a better alternative to internet than Spark is offering.  We only have a coper wire connection.\nReason for given NPS: I have had good service to date', 'Improvement needed: Information on fibre and and how to get it sorted to improve on what we have now\nReason for given NPS: Costly and slow Internet, not on fibre', 'Improvement needed: Mobile and wifi coverage in Titirangi. Our mobile coverage around the house is really bad. We have fibre broadband but it is very slow at times\nReason for given NPS: Good customer service']"
intermittent_network_unreliability_in_some_areas,10, ,"['Improvement needed: Your connectivity\nReason for given NPS: There are a few things need sorting with our internet and phone connection. Bad weather can affect coverage and often connections will drop out unexpectantly', 'Improvement needed: Fix the reception and connectivity problem since the switch from Vodafone.  A lower price for mobile and wifi for single people living alone.\nReason for given NPS: Very expensive for just a mobile and wifi (over $120 a month), and after the switch from Vodafone to OneNZ my general mobile reception, wifi speed and connectivity has decreased.', 'Improvement needed: Getting me an internet connection, you’ve no problem charging every month for it, it would be nice to receive it.\nReason for given NPS: Paying for internet without receiving internet three quarters of the time.', 'Improvement needed: Internet\nReason for given NPS: Because we live at Maungatapere and have endest problems with One NZ', ""Improvement needed: The satellite and partnership around that will improve my access to all services and information I use.\nReason for given NPS: Will be a 10 when you're satellite goes up next year. Hopefully that will deal with no coverage areas and access being lost due to very windy and/or stormy weather.""]"
uncompetitive_pricing_compared_to_competitors,10, ,"['Improvement needed: Better priced plans\nReason for given NPS: Seem a little more expensive than competitors', ""Improvement needed: I think costs have risen service is no better the app and website arnt usable. Reception is poor in our house and the modem drops out. I'd be happier if 10$ less a month frankly\nReason for given NPS: Reception cover poor vs spark"", 'Improvement needed: More competitive pricing\n', 'Improvement needed: Pricing for plans better priced.\n', 'Improvement needed: reduce the plan pricing\nReason for given NPS: you do what we expect']"
intermittent_disconnection_issues_with_cellular_network,10, ,"['Improvement needed: Your connectivity\nReason for given NPS: There are a few things need sorting with our internet and phone connection. Bad weather can affect coverage and often connections will drop out unexpectantly', ""Improvement needed: I think costs have risen service is no better the app and website arnt usable. Reception is poor in our house and the modem drops out. I'd be happier if 10$ less a month frankly\nReason for given NPS: Reception cover poor vs spark"", 'Improvement needed: network coverage\nReason for given NPS: apart from the poor network coverage, my account always comes to me and reminders to pay.  What I get seems to suit me.', 'Improvement needed: Getting me an internet connection, you’ve no problem charging every month for it, it would be nice to receive it.\nReason for given NPS: Paying for internet without receiving internet three quarters of the time.', ""Improvement needed: Reception around the country could be improved for some reason I'll have 4g signal then it disappears for whatever reason\nReason for given NPS: Had an issue with an account & no-one replied until I copied CEO in!!""]"
customer_wants_lower_priced_plans,9, ,"['Improvement needed: Offer lower cost plans/packages.\n', 'Improvement needed: Cheaper rates\n', 'Improvement needed: Expensive at plan\nReason for given NPS: Good experience', 'Improvement needed: More competitive pricing\n', 'Improvement needed: reduce the plan pricing\nReason for given NPS: you do what we expect']"
need_for_proactive_plan_recommendations,9, ,"['Improvement needed: Looking at our plans and if they are no longer current, making us an offer ti change\nReason for given NPS: I have been with One NZ/Vodafone/Bell South for 30 years, consistent, transparent service.', 'Improvement needed: Customer service- also cisibility or recommending best current plans and pricing\nReason for given NPS: Much of a much mess providers- your customer service in store is terrible and also on phone -takes ages to get through.', 'Improvement needed: Check on our plan and call us if you see a better option available within One NZ\nReason for given NPS: It works well for broadband and mobile for wife and I in NZ and overseas', 'Improvement needed: Be proactive in managing accounts, setup yearly reviews or make it easy to do it myself online.\n\nGenerally I can save money when I get someone on the phone but it’s at my behest and not something I can just check online.\nReason for given NPS: I have no major issues when everything is working (which it generally is) but when things change the back end systems can be unforgiving and can be frustrating to fix.', 'Improvement needed: Keeping customers up to date with new plans. I keep mine the same until i went in store to get a new phone and then they changed all my plans for broadband and monthly cell phone.\nReason for given NPS: Ive been with them since i was 14. Everything has been fine. Its all i know']"
need_for_more_pricing_options,8, ,"['Reason for given NPS: I find it good but some people want different options', 'Improvement needed: Pricing for plans better priced.\n', ""Improvement needed: Maybe some extras monthly plans and improve the coverage in some areas that doesn't work very well, but good enough anyway.\nReason for given NPS: Good service, but coverage around Queenstown and other places could improve. Fair price (although it could be better). And it was some problems in the website a few weeks ago, now fix it."", 'Improvement needed: Would be great to have more options of  plans with movil data.\n', 'Improvement needed: As increase in GB would be awesome.\nReason for given NPS: Have found them very easy to deal with. The change over from Vodafone to One was seamless. Always have great deals and I find it very cost effective for myself. Looking forward to seeing what they are planning for the future']"
difficulty_communicating_with_call_center_agents,8, ,"['Improvement needed: Sometimes hard to understand an operator when talking to them found it easier going into a store\n', 'Improvement needed: It is quite difficult to deal with the call centre at times .. much easier to just go into the store to sort out problems when possible .. call centre could definitely do with some improvement\n', 'Improvement needed: I find the personal manning your help lines are very hard to understand at times because\nof their accents and English not being their first language.\nReason for given NPS: Very satisfied with my current arrangements and support.', 'Improvement needed: Clear speaking staff\nReason for given NPS: Took 2 days for shop staff to do paperwork..then the bill was incorrect', 'Improvement needed: Communication especially at call centre\nReason for given NPS: continual issues with service. Very difficult to resolve due to poor communication.']"
lack_of_prioritized_customer_experience,8, ,"['Improvement needed: Customer service- also cisibility or recommending best current plans and pricing\nReason for given NPS: Much of a much mess providers- your customer service in store is terrible and also on phone -takes ages to get through.', 'Improvement needed: Customer service & technical knowledge in the Cambridge One Nz store( very keen to hook me in tgen disinterested. A staff member actually used my new I phone to claim my Spotify hours so very unimpressed.\nReason for given NPS: I like the response One Nz is making to block pornography of children from reaching or being able to access by anyone in Nz; also agree with the commitment to ensure total accessibility of mobile phone users through out Nz', 'Improvement needed: Customer support\nReason for given NPS: Happy with my service', ""Improvement needed: Cost is always a consideration, particularly when one is on a limited income ie: pension.\nWould it be possible to instigate a discount for Gold card members? This wouldn't impact on your profit very much.\nThe other thing that is annoying to a large group of customers is the time it takes to get assistance over the phone. Sometimes it is easier to travel to a ONE shop for assistance.\nReason for given NPS: I put 5 down because I am unsure about other companies out there and how you compare to them."", 'Improvement needed: Keener pricing service and equipment not competitive ...\nAlso  need easier billing\nReason for given NPS: ¹Need to improve communication on contract issues. \n² On- line dealings w robot, extremely awkward, need more characters or line.']"
lack_of_deals_promotions_for_existing_customers,8, ,"['Improvement needed: Perhaps some of the deals that are offered to new customers could be given to us that have stuck with you for a number of years\nReason for given NPS: All contact with your services been excellent', 'Improvement needed: Broadband and mobile accounts linked\nReason for given NPS: Not always easy to access account info. Pricing incentives for new members not available', ""Improvement needed: Pricing deals for existing customers.\nReason for given NPS: The service provided is great but I feel I'm currently paying a lot for our broadband as our discount ended."", 'Improvement needed: Include marketing offers to existing customers\nReason for given NPS: Customer for many years, anytime l had a question or issue it was sorted very quickly', 'Improvement needed: Return of new phone + contact deals for existing (especially long-term) customers! Also, Google Pixel phones.\n']"
lack_of_clarity_on_current_plans,7, ,"['Improvement needed: I think it would just be more information on certain sectors that you have in your company and the correct contact details for them. You should also look into your insurance policies and the definitions that you have for ALL of your customers\nReason for given NPS: Your services are great and are affordable than other phone service providers i have tried. I like the constant communication with the customer and the convenience of the app too', 'Improvement needed: Customer service- also cisibility or recommending best current plans and pricing\nReason for given NPS: Much of a much mess providers- your customer service in store is terrible and also on phone -takes ages to get through.', 'Improvement needed: Providing actual communication about plan options.\nReason for given NPS: I was not informed that I was switched to One. I then got a giant bill that was not adequately explained to me before I was even provided an online login. My rates are not good for a family plan. I am actively seeking another option.', 'Improvement needed: Broadband and mobile accounts linked\nReason for given NPS: Not always easy to access account info. Pricing incentives for new members not available', 'Improvement needed: Everything from service to plans\nReason for given NPS: Failed on 2 occasions, both related to landline.\nPlus mobile data still get used rather then the home wi fi.']"
